{
  "schema_version": 1,
  "corpus_id": "codefabric.relational-fabric.independent-evidence",
  "corpus_version": "1.0.0-candidate.1",
  "status": "review-candidate",
  "purpose": "Decoded semantic expectations authored from accepted design, exact upstream API references, and released public contracts without consulting target implementation output.",
  "owners": [
    {
      "owner_id": "wp22-independent-semantic-owner",
      "role": "Independent semantic evidence curator",
      "independence_class": "independent-from-production-producers",
      "accountability": "Owns rationale, limitations, causal discrimination, and successor review; may not implement or derive expectations from production providers, compilers, query execution, or release output."
    }
  ],
  "sources": [
    {
      "source_id": "design-v2",
      "kind": "normative_design",
      "path": "docs/designs/codefabric_execution_proved_relational_data_fabric_design_v2_2026-08-29.md",
      "sha256": "dd154d818b825b9b2d177a9aef0bf62e3db36b0288d49c235c9001f82edc7dc9",
      "locator": "D-20, D-23, D-28 through D-34, and sections 6.1 through 6.8",
      "identity": "codefabric-execution-proved-relational-data-fabric design v2"
    },
    {
      "source_id": "ontology-v2",
      "kind": "normative_design",
      "path": "docs/authoritative_design/code_property_graph_present_state_fact_ontology_specification_v2.0.md",
      "sha256": "e9aafbc3c5e8e3581508d3ad6b8a827483a005af43fcf9aef85adf0ce2f65729",
      "locator": "typed fact relations, identity, unknown semantics, and derived families",
      "identity": "codefabric-relational-data-fabric ontology 2.0.0"
    },
    {
      "source_id": "generation-v2",
      "kind": "normative_design",
      "path": "docs/authoritative_design/present_state_cpg_fact_generation_specification_python_rust_v2.0.md",
      "sha256": "cfef1153dd893b1f431772837d549bc1bb44226e3a2ac2323f6341d57819d8f8",
      "locator": "provider-native extraction, authority, reconciliation, and capability",
      "identity": "codefabric-relational-data-fabric generation 2.0.0"
    },
    {
      "source_id": "fabric-v2",
      "kind": "normative_design",
      "path": "docs/authoritative_design/present_state_cpg_data_fabric_specification_rust_arrow_datafusion_deltalake_v2.0.md",
      "sha256": "5c2b63c54abe0f10e663c0559bd6ca907721ebacb67ff0846f709a96d3c0e160",
      "locator": "Arrow relations, DataFusion programs, FabricEpoch, proof, and resources",
      "identity": "codefabric-relational-data-fabric fabric 2.0.0"
    },
    {
      "source_id": "query-v2",
      "kind": "normative_design",
      "path": "docs/authoritative_design/code_property_graph_semantic_query_specification_v2.0.md",
      "sha256": "ef29546bf4d20d799bcee8d311d1442848005294511ab317643db73e2da9a384",
      "locator": "sections 4 through 13",
      "identity": "codefabric-relational-data-fabric query 2.0.0"
    },
    {
      "source_id": "lifecycle-v2",
      "kind": "normative_design",
      "path": "docs/authoritative_design/codefabric_continuous_cpg_update_lifecycle_management_specification_v2.0.md",
      "sha256": "1a8c19809cacb147ae395138603adea55f9d80ac7620c47f0c79416d3d08edc4",
      "locator": "FabricCommand, activation, leases, fencing, and recovery",
      "identity": "codefabric-relational-data-fabric lifecycle 2.0.0"
    },
    {
      "source_id": "serving-v2",
      "kind": "normative_design",
      "path": "docs/authoritative_design/present_state_cpg_fastmcp_serving_specification_v2.0.md",
      "sha256": "df116dda5f38c11c3c97c20850e8740375a67e2ca683347d0f01e267f9e4dad0",
      "locator": "Rust-daemon authority, relation streams, and presentation-only serving",
      "identity": "codefabric-relational-data-fabric serving 2.0.0"
    },
    {
      "source_id": "tree-sitter-api",
      "kind": "upstream_api",
      "path": "docs/library_ref/tree_sitter_rust_python.md",
      "sha256": "615ce801958a3e74bf8cbbd5d759bade62958b1e4297185ebe8b18aa87e1428b",
      "locator": "Parser::parse, Node, Query, QueryCursor, error recovery, Python and Rust grammar chapters",
      "identity": "tree-sitter 0.26.12; tree-sitter-python 0.25.0; tree-sitter-rust 0.24.2"
    },
    {
      "source_id": "ruff-api",
      "kind": "upstream_api",
      "path": "docs/library_ref/ruff_python_crates_advanced_reference_2026-08-18.md",
      "sha256": "f42e0b5e3d63c66bde68e2c3b79cef04d288eec52ee64e424f3d95578fc386d6",
      "locator": "sections 4.7 and 4.8 parse_unchecked and parse_unchecked_source; typed AST, tokens, trivia, scopes, and bindings",
      "identity": "Ruff Python crates 0.0.7"
    },
    {
      "source_id": "pyrefly-api",
      "kind": "upstream_api",
      "path": "docs/library_ref/pyrefly_rust_cpg_advanced_reference_1.2.0_2026-08-19.md",
      "sha256": "208582927c109dde0d399a7277442417006c878dfd21403a09a5c0bc7b2819e1",
      "locator": "sections 9 through 16 and 24 through 29: Query, TSP, module resolver, Glean/LSP roles, coordinates, and uncertainty",
      "identity": "Pyrefly 1.2.0 source revision 1933169ad8ee9e4d4114112eb56ef0811fb0a094"
    },
    {
      "source_id": "rustc-api",
      "kind": "upstream_api",
      "path": "docs/library_ref/rust_mir_cpg_continuous_reference_2026-08-18.md",
      "sha256": "1584a4ca9c7a06a495cfedacf585717aaec61949546d0191b19df48451451ea5",
      "locator": "rustc_public::run!, MIR Body/visitor/Instance, section 4 surface selection, stable identity, and narrow rustc_private seam",
      "identity": "rustc_public 1.100.0-nightly on nightly-2026-08-18"
    },
    {
      "source_id": "query-form-contract",
      "kind": "released_public_contract",
      "path": "contracts/query/query-form-contract.json",
      "sha256": "985369db3c946142ba538d26a0756e30970eac9e7dc18e8f85862194b796d1ef",
      "locator": "forms and result_roles",
      "identity": "codefabric.query.form-contract 1.0 released"
    },
    {
      "source_id": "query-request-contract",
      "kind": "released_public_contract",
      "path": "contracts/schema/cpg-semantic-query-request.schema.json",
      "sha256": "3e10e1192fae11b1976e21b9dc17257a2b048102892c5d860ed4557dbfd584ef",
      "locator": "request envelope",
      "identity": "released semantic query request schema"
    },
    {
      "source_id": "query-response-contract",
      "kind": "released_public_contract",
      "path": "contracts/schema/cpg-semantic-query-response.schema.json",
      "sha256": "0c3c29141d58bf7c7a91556320ea53e7ad001486128cfb1368dd31e2118897fc",
      "locator": "response envelope and terminal semantics",
      "identity": "released semantic query response schema"
    },
    {
      "source_id": "grpc-query-contract",
      "kind": "released_public_contract",
      "path": "contracts/rpc/cpg_query_service.proto",
      "sha256": "ec5c773af9f9cc3ba503ca3ed0b10a91471c8696d0a8aedbcd1afedd8bfa10b8",
      "locator": "query, status, result, reference, and stream RPC messages",
      "identity": "codefabric.cpgd.v1 released Protobuf contract"
    },
    {
      "source_id": "public-status-contract",
      "kind": "released_public_contract",
      "path": "contracts/schema/public-status.schema.json",
      "sha256": "417cdddf35c1fd0247647ae6380111d4c53baec51d0bd23731d59cd49402171c",
      "locator": "public status projection",
      "identity": "released public status schema"
    },
    {
      "source_id": "public-snapshot-contract",
      "kind": "released_public_contract",
      "path": "contracts/schema/public-snapshot-metadata.schema.json",
      "sha256": "3d3e6d15bbeb00d67d4010268a4b41c82e4c7c838396957cf67e07dc29dea2b1",
      "locator": "public snapshot metadata",
      "identity": "released public snapshot metadata schema"
    },
    {
      "source_id": "security-contract",
      "kind": "security_contract",
      "path": "contracts/security/security-corpus-manifest.yaml",
      "sha256": "09289fd6b8160d91a02a6eebca94a44d923f7f0cabe2711fa3c8447c3ebf61bc",
      "locator": "hostile, bounded decode, source-race, redaction, and cleanup cases",
      "identity": "codefabric-security-v1 1.0 released"
    },
    {
      "source_id": "fault-contract",
      "kind": "security_contract",
      "path": "contracts/faults/fault-point-registry.yaml",
      "sha256": "a461f65c4a462522947df0967962492ed5da46e9db96d5d502054bc518c128f9",
      "locator": "activation and recovery fault points",
      "identity": "released CodeFabric fault-point registry"
    },
    {
      "source_id": "toolchain-contract",
      "kind": "toolchain_contract",
      "path": "contracts/toolchain/toolchain-identity.json",
      "sha256": "23ea774fc5db1a72ddf2b29b603118acdd6617435f0ffc849f417c9ce6f37b80",
      "locator": "exact data-fabric, extractor, adapter, and protocol identities",
      "identity": "codefabric.toolchain.identity 1.0 released"
    }
  ],
  "global_limitations": [
    "These decoded rows are a minimal discriminating corpus, not proof that unrepresented programs have identical semantics.",
    "Provider expectations are bound to the exact referenced versions and must be superseded, never rewritten, when an API changes.",
    "The candidate was authored after implementation consumers had begun and is therefore not accepted by the accompanying review transaction.",
    "No exact historical comparator executable or root rustc/cargo binary identity was captured; old/new comparison remains blocked.",
    "Performance rows define workloads and cleanup/resource invariants but do not invent unapproved latency thresholds."
  ],
  "expectations": [
    {
      "expectation_id": "RF-EV-001",
      "category": "bootstrap_model_semantics",
      "subject": "immutable migration replay and self-describing metamodel closure",
      "query_form": null,
      "analysis_families": [],
      "owner_id": "wp22-independent-semantic-owner",
      "rationale": "A migration is accepted history; replay must create typed relation rows while predecessor mutation or bootstrap/model disagreement fails.",